{
  "$schema": "https://json-schema.org/draft/2020-12/schema",
  "$id": "https://schemas.socioprophet.org/memory-mesh/agent-learning-proposal.schema.json",
  "title": "Memory Mesh Agent Learning Proposal",
  "type": "object",
  "required": [
    "apiVersion",
    "kind",
    "proposalId",
    "createdAt",
    "sourceSession",
    "destination",
    "proposalMode",
    "learningType",
    "learning",
    "review",
    "evidenceRefs",
    "policyDecisionRefs"
  ],
  "properties": {
    "apiVersion": { "const": "memory.mesh.agent-learning/v1" },
    "kind": { "const": "AgentLearningProposal" },
    "proposalId": { "type": "string", "minLength": 1 },
    "createdAt": { "type": "string", "format": "date-time" },
    "sourceSession": {
      "type": "object",
      "required": ["sessionRef", "taskRef", "repo", "agentRef"],
      "properties": {
        "sessionRef": { "type": "string", "minLength": 1 },
        "taskRef": { "type": "string", "minLength": 1 },
        "repo": { "type": "string", "minLength": 1 },
        "agentRef": { "type": "string", "minLength": 1 },
        "workcellArtifactRef": { "type": ["string", "null"] },
        "invocationArtifactRef": { "type": ["string", "null"] },
        "stopGateArtifactRef": { "type": ["string", "null"] }
      },
      "additionalProperties": false
    },
    "destination": {
      "type": "object",
      "required": ["scope", "targetRef", "path"],
      "properties": {
        "scope": { "enum": ["repo", "project", "user", "organization", "enterprise"] },
        "targetRef": { "type": "string", "minLength": 1 },
        "path": { "type": "string", "minLength": 1 },
        "memoryNamespace": { "type": ["string", "null"] }
      },
      "additionalProperties": false
    },
    "proposalMode": { "enum": ["review_only", "approved_writeback"] },
    "learningType": { "enum": ["operational-fact", "playbook-update", "policy-note", "tooling-note", "risk-note", "architecture-note"] },
    "learning": {
      "type": "object",
      "required": ["title", "summary", "rationale", "proposedDiff"],
      "properties": {
        "title": { "type": "string", "minLength": 1 },
        "summary": { "type": "string", "minLength": 1 },
        "rationale": { "type": "string", "minLength": 1 },
        "proposedDiff": {
          "type": "object",
          "required": ["format", "content"],
          "properties": {
            "format": { "enum": ["unified-diff", "markdown-section", "json-patch", "none"] },
            "content": { "type": "string" }
          },
          "additionalProperties": false
        },
        "conflictsWith": { "type": "array", "items": { "type": "string" } },
        "confidence": { "type": "number", "minimum": 0, "maximum": 1 },
        "retention": { "enum": ["session-only", "repo-durable", "project-durable", "org-durable", "enterprise-durable"] }
      },
      "additionalProperties": false
    },
    "observationContext": {
      "type": "object",
      "required": ["observedAt", "validTime", "freshnessPolicy", "samplingBasis", "compressionBasis"],
      "properties": {
        "sourceWindowRef": { "type": ["string", "null"] },
        "observedAt": { "type": "string", "format": "date-time" },
        "validTime": {
          "type": "object",
          "required": ["start", "end"],
          "properties": {
            "start": { "type": ["string", "null"], "format": "date-time" },
            "end": { "type": ["string", "null"], "format": "date-time" }
          },
          "additionalProperties": false
        },
        "freshnessPolicy": {
          "type": "object",
          "required": ["staleAfter", "expiryRef"],
          "properties": {
            "staleAfter": { "type": ["string", "null"], "format": "date-time" },
            "expiryRef": { "type": ["string", "null"] }
          },
          "additionalProperties": false
        },
        "samplingBasis": { "type": "string", "minLength": 1 },
        "compressionBasis": { "type": "string", "minLength": 1 }
      },
      "additionalProperties": false
    },
    "representationEnvelope": {
      "type": "object",
      "required": [
        "frameType",
        "authoritySource",
        "sourceEpoch",
        "validityWindow",
        "cacheState",
        "dirtyState",
        "revocationStatus",
        "correlationId",
        "evidenceRefs",
        "provenanceRefs",
        "policyContext",
        "writePolicy"
      ],
      "properties": {
        "frameType": { "enum": ["observation", "proposal", "accepted-memory", "playbook-update", "policy-note", "evidence-receipt"] },
        "authoritySource": { "type": "string", "minLength": 1 },
        "sourceEpoch": { "type": "string", "minLength": 1 },
        "validityWindow": {
          "type": "object",
          "required": ["start", "end"],
          "properties": {
            "start": { "type": ["string", "null"], "format": "date-time" },
            "end": { "type": ["string", "null"], "format": "date-time" }
          },
          "additionalProperties": false
        },
        "cacheState": { "enum": ["invalid", "shared_valid", "exclusive_authoritative", "modified_uncommitted", "stale", "revoked", "pending_review", "promoted"] },
        "dirtyState": { "enum": ["clean", "dirty", "unknown"] },
        "revocationStatus": { "enum": ["active", "revoked", "superseded", "unknown"] },
        "correlationId": { "type": "string", "minLength": 1 },
        "evidenceRefs": { "type": "array", "minItems": 1, "items": { "type": "string" } },
        "provenanceRefs": { "type": "array", "items": { "type": "string" } },
        "policyContext": {
          "type": "object",
          "required": ["policyDecisionRefs", "capabilityRefs"],
          "properties": {
            "policyDecisionRefs": { "type": "array", "items": { "type": "string" } },
            "capabilityRefs": { "type": "array", "items": { "type": "string" } }
          },
          "additionalProperties": false
        },
        "writePolicy": {
          "type": "object",
          "required": ["mode", "reviewRequired"],
          "properties": {
            "mode": { "enum": ["no-writeback", "reviewed-writeback", "approved-writeback"] },
            "reviewRequired": { "type": "boolean" }
          },
          "additionalProperties": false
        }
      },
      "additionalProperties": false
    },
    "learningSignal": {
      "type": "object",
      "required": ["signalClass", "noiseAssumption", "confidence", "abstentionBoundary"],
      "properties": {
        "signalClass": { "enum": ["human-observed", "agent-observed", "detector-derived", "ranker-derived", "evaluator-derived", "mixed"] },
        "noiseAssumption": { "type": "string", "minLength": 1 },
        "confidence": { "type": "number", "minimum": 0, "maximum": 1 },
        "abstentionBoundary": { "type": "string", "minLength": 1 },
        "detectorRef": { "type": ["string", "null"] },
        "evaluationReceiptRefs": { "type": "array", "items": { "type": "string" } }
      },
      "additionalProperties": false
    },
    "reviewQueue": {
      "type": "object",
      "required": ["proposalArrivedAt", "reviewRequiredBy", "blockedReason", "staleAfter"],
      "properties": {
        "proposalArrivedAt": { "type": "string", "format": "date-time" },
        "reviewRequiredBy": { "type": ["string", "null"], "format": "date-time" },
        "blockedReason": { "type": ["string", "null"] },
        "staleAfter": { "type": ["string", "null"], "format": "date-time" },
        "promotionLatency": { "type": ["string", "null"] }
      },
      "additionalProperties": false
    },
    "review": {
      "type": "object",
      "required": ["required", "status", "reviewerRefs", "approvalRef"],
      "properties": {
        "required": { "type": "boolean" },
        "status": { "enum": ["pending", "approved", "rejected", "superseded"] },
        "reviewerRefs": { "type": "array", "items": { "type": "string" } },
        "approvalRef": { "type": ["string", "null"] },
        "reviewNotes": { "type": ["string", "null"] }
      },
      "additionalProperties": false
    },
    "evidenceRefs": { "type": "array", "minItems": 1, "items": { "type": "string" } },
    "policyDecisionRefs": { "type": "array", "minItems": 1, "items": { "type": "string" } },
    "redaction": {
      "type": "object",
      "required": ["rawSensitivePayloadStored", "redactionSummary"],
      "properties": {
        "rawSensitivePayloadStored": { "type": "boolean" },
        "redactionSummary": { "type": "string" }
      },
      "additionalProperties": false
    },
    "writeback": {
      "type": "object",
      "required": ["enabled", "performed", "writebackRef"],
      "properties": {
        "enabled": { "type": "boolean" },
        "performed": { "type": "boolean" },
        "writebackRef": { "type": ["string", "null"] }
      },
      "additionalProperties": false
    }
  },
  "additionalProperties": false
}
